Text,University name,Address,Latitude,Longitude,Found Address,Match Quality,Source
"Loyola University, Maryland <br /><a href='https://fbe.mijnhva.nl/en/fbe-az/study-abroad/Fact%20sheets%20partnerinstitutes/Loyola%20University%20Maryland.doc'>Factsheet<a/>","Loyola University, Maryland","4501 North Charles Street, Baltimore, MD 21210, USA",39.3462249,-76.6213069,"4501 N Charles St, Baltimore, MD 21210, USA",Match,Google
"Northern Arizona University, Flagstaff <br /><a href='https://fbe.mijnhva.nl/en/fbe-az/study-abroad/Fact%20sheets%20partnerinstitutes/Northern%20Arizona%20University.docx'>Factsheet<a/>","Northern Arizona University, Flagstaff","1899 S San Francisco St, Flagstaff, AZ 86011, USA",35.1811687,-111.6519781,"1899 S San Francisco St, Flagstaff, AZ 86001, USA",Match,Google
Southeast Missouri State University <br /><a href='https://fbe.mijnhva.nl/en/fbe-az/study-abroad/Fact%20sheets%20partnerinstitutes/Southeast%20Missouri%20State%20University.docx'>Factsheet<a/>,Southeast Missouri State University,"1 University Plaza, Cape Girardeau, MO 63701, USA",37.3126443,-89.5310043,"1 University Plaza, Cape Girardeau, MO 63701, USA",Match,Google
State University of New York at Buffalo <br /><a href='https://fbe.mijnhva.nl/en/fbe-az/study-abroad/Fact%20sheets%20partnerinstitutes/Buffalo%20State%20College%20at%20Buffalo.docx'>Factsheet<a/>,State University of New York at Buffalo,"Buffalo, NY 14260, USA",42.8711,-78.8593199,"Buffalo, NY 14260, USA",Match,Google
University of Central Oklahoma <br /><a href=''>Factsheet<a/>,University of Central Oklahoma,"100 N University Dr, Edmond, OK 73034, USA",35.6551099,-97.4720166,"100 N University Dr, Edmond, OK 73034, USA",Match,Google
"University of Miami, Florida <br /><a href='https://fbe.mijnhva.nl/en/fbe-az/study-abroad/Fact%20sheets%20partnerinstitutes/University%20of%20Miami.docx'>Factsheet<a/>","University of Miami, Florida","University of Miami, Florida",25.7191685,-80.2771253,"1320 S Dixie Hwy, Coral Gables, FL 33146, USA",Match,Google
Hutech University Saigon <br /><a href='https://fbe.mijnhva.nl/en/fbe-az/study-abroad/Fact%20sheets%20partnerinstitutes/Hutech%20University.docx'>Factsheet<a/>,Hutech University Saigon,"475 A Điện Biên Phủ, Phường 25, Bình Thạnh, Hồ Chí Minh, Vietnam",10.801675,106.714432,"475a Điện Biên Phủ, Phường 25, Bình Thạnh, Hồ Chí Minh 70000, Vietnam",Partial Match,Google
RMIT University Vietnam <br /><a href='https://fbe.mijnhva.nl/en/fbe-az/study-abroad/Fact%20sheets%20partnerinstitutes/RMIT%20Vietnam%20factsheet.docx'>Factsheet<a/>,RMIT University Vietnam,"702 Nguyễn Văn Linh, Tân Hưng, Quận 7, Hồ Chí Minh 700000, Vietnam",10.7294434,106.6927383,"702 Nguyễn Văn Linh, Tân Hưng, Quận 7, Hồ Chí Minh, Vietnam",Match,Google
