Text,University name,Address,Latitude,Longitude,Found Address,Match Quality,Source
UADE <br /><a href='https://fbe.mijnhva.nl/en/fbe-az/study-abroad/_layouts/15/WopiFrame.aspx?sourcedoc=/en/fbe-az/study-abroad/Fact%20sheets%20partnerinstitutes/UADE.docx&action=default'>Factsheet<a/>,UADE,Av. Intermédanos Sur 776,-37.115962,-56.885179,"Av. Intermédanos 776, B7167CAV Pinamar, Buenos Aires, Argentina",Match,Google
Universidad Austral <br /><a href='https://fbe.mijnhva.nl/en/fbe-az/study-abroad/Fact%20sheets%20partnerinstitutes/Universidad-Austral-Factsheet-2019-3.pdf'>Factsheet<a/>,Universidad Austral,"Mariano Acosta 1611, B1630FHB Pilar, Buenos Aires",-34.4565622,-58.8589786,"Mariano Acosta 1611, La Lonja, Buenos Aires, Argentina",Match,Google
Universidad del Salvador (USAL) <br /><a href='https://fbe.mijnhva.nl/en/fbe-az/study-abroad/_layouts/15/WopiFrame.aspx?sourcedoc=/en/fbe-az/study-abroad/Fact%20sheets%20partnerinstitutes/USAL%20factsheet.doc&action=default'>Factsheet<a/> <br /><a href='https://www.youtube.com/watch?v=57waq1HdllQ&t=3s'>Promotional Video<a/>, Universidad del Salvador (USAL), Buenos Aires,”Avda. Callao esquina Córdoba C1023AAB”,-34.5996357,-58.3929341,"Av. Córdoba & Av. Callao, C1055 CABA, Argentina",Match,Google
Curtin University <br /><a href='https://fbe.mijnhva.nl/en/fbe-az/study-abroad/Fact%20sheets%20partnerinstitutes/RMIT%20Australia%20factsheet.doc'>Factsheet<a/>,Curtin University,"Kent Street, Bentley, Perth, Western Australia, 6102",-32.0012929,115.887358,"Kent St, Bentley DC WA 6102, Australia",Match,Google
Royal Melbourne Institute of Technology (RMIT) <br /><a href='https://fbe.mijnhva.nl/en/fbe-az/study-abroad/Fact%20sheets%20partnerinstitutes/RMIT%20Australia%20factsheet.doc'>Factsheet<a/>,Royal Melbourne Institute of Technology (RMIT),"124 La Trobe Street, Melbourne VIC 3000",-37.808077,144.9644363,"124 La Trobe St, Melbourne VIC 3000, Australia",Match,Google
University of Southern Queensland <br /><a href='https://fbe.mijnhva.nl/en/fbe-az/study-abroad/Fact%20sheets%20partnerinstitutes/USQ%20factsheet.doc'>Factsheet<a/>,University of Southern Queensland,"West St, Darling Heights QLD 4350, Australia",-27.6042497,151.9355999,"West St, Darling Heights QLD 4350, Australia",Match,Google
